Place_Id,Place_Name,Description,Category,City,Price,Rating,Time_Minutes,Coordinate,Lat,Long,Column1,_1,Rating_Count,combined_text,clean_text
316,Curug Malela,"Curug Malela adalah salah satu destinasi alam yang berupa air terjun. Curug ini memilliki keindahan yang luar biasa. Jadi tak heran banyak para pengunjung yang datang untuk mengunjungi curug ini. Para pengunjung yang datang tidak hanya dari dalam kota saja, namun juga dari luar kota seperti DKI jakarta, Jawa Tengah, Jawa Barat dan masih banyak lagi. Curug ini memiliki ketinggian yang cukup tinggi yaitu sekitar 60 sampai 70 meter. Namun curug ini memiliki lebar yang cukup sempit yaitu sekitar 50 meter saja. Curug yang menjulang tinggi ini memiliki air yang sangat deras dan dingin. Jadi jika kamu berdiri di dekat air terjun ini siap siap pakaianmu akan basah terkena cipratan air. Air terjun Malela tidak hanya terdiri dari satu pancuran air saja, namun terdiri dari beberapa pancuran air yang berdekatan. Karena curug ini memiliki pancuran air yang berjejeran seperti air terjun niagara yang ada di Amerika, banyak para pengunjung yang menyebutnya sebagai “Niagara nya Cianjur”._x000D_",Cagar Alam,Bandung,10000,44,,"{'lat': -7.0182386, 'lng': 107.2072145}",-70182386,1072072145,,316,21,"Curug Malela Curug Malela adalah salah satu destinasi alam yang berupa air terjun. Curug ini memilliki keindahan yang luar biasa. Jadi tak heran banyak para pengunjung yang datang untuk mengunjungi curug ini. Para pengunjung yang datang tidak hanya dari dalam kota saja, namun juga dari luar kota seperti DKI jakarta, Jawa Tengah, Jawa Barat dan masih banyak lagi. Curug ini memiliki ketinggian yang cukup tinggi yaitu sekitar 60 sampai 70 meter. Namun curug ini memiliki lebar yang cukup sempit yaitu sekitar 50 meter saja. Curug yang menjulang tinggi ini memiliki air yang sangat deras dan dingin. Jadi jika kamu berdiri di dekat air terjun ini siap siap pakaianmu akan basah terkena cipratan air. Air terjun Malela tidak hanya terdiri dari satu pancuran air saja, namun terdiri dari beberapa pancuran air yang berdekatan. Karena curug ini memiliki pancuran air yang berjejeran seperti air terjun niagara yang ada di Amerika, banyak para pengunjung yang menyebutnya sebagai “Niagara nya Cianjur”._x000D_ Cagar Alam Bandung",curug malela curug malela salah satu destinasi alam upa air terjun curug memilliki indah luar biasa jadi tak heran banyak unjung datang unjung curug unjung datang hanya dalam kota luar kota dki jakarta jawa tengah jawa barat masih banyak curug milik tinggi cukup tinggi sekitar meter namun curug milik lebar cukup sempit sekitar meter curug julang tinggi milik air sangat deras dingin jadi kamu diri dekat air terjun siap siap pakai basah kena ciprat air air terjun malela hanya diri satu pancur air namun diri dari beberapa pancur air dekat curug milik pancur air jejer air terjun niagara ada amerika banyak para unjung sebut niagara nya cianjur x d cagar alam bandung
317,Curug Cimahi,"Curug Cimahi adalah air terjun yang terletak di Jalan Kolonel Masturi, Desa Kertawangi, Kecamatan Cisarua, Kabupaten Bandung Barat, Jawa Barat. Dengan ketinggian sekitar 87 meter, menjadikan air terjun ini sebagai salah satu curug tertinggi di wilayah Bandung dan sekitarnya. Nama Cimahi berasal dari nama sungai yang mengalir di atasnya yaitu Sungai Cimahi yang berhulu di Situ (danau) Lembang dan mengalir ke Kota Cimahi. Destinasi wisata ini berjarak kurang lebih 10 kilometer dari Kota Cimahi ke arah Lembang atau 20 kilometer dari Kota Bandung.",Cagar Alam,Bandung,15000,46,30.0,"{'lat': -6.797738300000002, 'lng': 107.5783691}",-67977383,1075783691,,317,21,"Curug Cimahi Curug Cimahi adalah air terjun yang terletak di Jalan Kolonel Masturi, Desa Kertawangi, Kecamatan Cisarua, Kabupaten Bandung Barat, Jawa Barat. Dengan ketinggian sekitar 87 meter, menjadikan air terjun ini sebagai salah satu curug tertinggi di wilayah Bandung dan sekitarnya. Nama Cimahi berasal dari nama sungai yang mengalir di atasnya yaitu Sungai Cimahi yang berhulu di Situ (danau) Lembang dan mengalir ke Kota Cimahi. Destinasi wisata ini berjarak kurang lebih 10 kilometer dari Kota Cimahi ke arah Lembang atau 20 kilometer dari Kota Bandung. Cagar Alam Bandung",curug cimahi curug cimahi air terjun letak jalan kolonel masturi desa kertawangi camat cisarua kabupaten bandung barat jawa barat tinggi meter jadi air terjun bagai salah satu curug tinggi wilayah bandung sekitar nama cimahi asal nama sungai alir atas sungai cimahi hulu situ danau lembang alir kota cimahi destinasi wisata jarak kurang lebih kilometer kota cimahi arah lembang kilometer kota bandung cagar alam bandung
318,Situ Patenggang,"Situ Patenggang atau Situ Patengan adalah suatu danau yang terletak di kawasan objek wisata alam Bandung Selatan, Jawa Barat, Indonesia, tepatnya di Ciwidey. Terletak di ketinggian 1600 meter di atas permukaan laut, danau ini memiliki pemandangan yang sangat eksotik. Situ patenggang juga memiliki pemandangan alam yang asri, karena disekitarnya terdapat hamparan kebun teh.\nLuas Situ Patenggang sekitar 45.000 hektar. Serta total luas cagar alamnya mencapai 123.077,15 hektar. Situ patenggang selalu menjadi pilihan wisatawan terutama bagi mereka yang baru pulang dari tempat wisata Kawah Putih. Jaraknya dari wisata kawah putih hanya sekitar 7 KM dan membutuhkan waktu sekitar 10 menit saja.",Cagar Alam,Bandung,20000,45,,"{'lat': -7.1669649, 'lng': 107.3575344}",-71669649,1073575344,,318,19,"Situ Patenggang Situ Patenggang atau Situ Patengan adalah suatu danau yang terletak di kawasan objek wisata alam Bandung Selatan, Jawa Barat, Indonesia, tepatnya di Ciwidey. Terletak di ketinggian 1600 meter di atas permukaan laut, danau ini memiliki pemandangan yang sangat eksotik. Situ patenggang juga memiliki pemandangan alam yang asri, karena disekitarnya terdapat hamparan kebun teh.\nLuas Situ Patenggang sekitar 45.000 hektar. Serta total luas cagar alamnya mencapai 123.077,15 hektar. Situ patenggang selalu menjadi pilihan wisatawan terutama bagi mereka yang baru pulang dari tempat wisata Kawah Putih. Jaraknya dari wisata kawah putih hanya sekitar 7 KM dan membutuhkan waktu sekitar 10 menit saja. Cagar Alam Bandung",situ patenggang situ patenggang situ patengan suatu danau letak kawasan objek wisata alam bandung selatan jawa barat indonesia tepat ciwidey letak tinggi meter atas muka laut danau milik pandang sangat eksotik situ patenggang milik pandang alam asri sekitar dapat hampar kebun teh nluas situ patenggang hektar total luas cagar alam capai hektar situ patenggang selalu jadi pilih wisatawan utama mereka baru pulang tempat wisata kawah putih jarak wisata kawah putih km butuh waktu sekitar menit cagar alam bandung
319,Kawah Rengganis Cibuni,"Kawasan Bandung Selatan khususnya Ciwidey memang sudah dikenal sebagai destinasi wisata alam dengan panorama yang indah dan udara yang sejuk, oleh karena itu masyarakat perkotaan memilih berwisata ke Ciwidey untuk “melarikan” diri dari kesibukan mereka di Kota. Wisata Ciwidey yang satu ini tidak kalah eksotis dari Kawah Putih, Rancaupas atau Situ Patenggang. Berdasarkan catatan Sejarah Kawah Rengganis, kawah ini sudah terbentuk akibat proses alam jutaan tahun lalu. Dimana berdasarkan penelitian, Kawah Rengganis ini terbentuk dari dahsyatnya letusan Gunung Sunda Purba, khususnya Gunung Patuha, yang juga menciptakan kawah lainnya, Kawah Putih. Bukti kedahsyatan letusannya bisa kita lihat sendiri, dimana hingga saat ini di Kawah Rengganis masih tercium begitu kuat aroma bau belerang dari areal kawahnya.",Cagar Alam,Bandung,5000,43,,"{'lat': -7.172412599999999, 'lng': 107.3766656}",-71724126,1073766656,,319,30,"Kawah Rengganis Cibuni Kawasan Bandung Selatan khususnya Ciwidey memang sudah dikenal sebagai destinasi wisata alam dengan panorama yang indah dan udara yang sejuk, oleh karena itu masyarakat perkotaan memilih berwisata ke Ciwidey untuk “melarikan” diri dari kesibukan mereka di Kota. Wisata Ciwidey yang satu ini tidak kalah eksotis dari Kawah Putih, Rancaupas atau Situ Patenggang. Berdasarkan catatan Sejarah Kawah Rengganis, kawah ini sudah terbentuk akibat proses alam jutaan tahun lalu. Dimana berdasarkan penelitian, Kawah Rengganis ini terbentuk dari dahsyatnya letusan Gunung Sunda Purba, khususnya Gunung Patuha, yang juga menciptakan kawah lainnya, Kawah Putih. Bukti kedahsyatan letusannya bisa kita lihat sendiri, dimana hingga saat ini di Kawah Rengganis masih tercium begitu kuat aroma bau belerang dari areal kawahnya. Cagar Alam Bandung",kawah rengganis cibuni kawasan bandung selatan khusus ciwidey memang kenal destinasi wisata alam panorama indah udara sejuk karena masyarakat kota pilih wisata ciwidey lari diri sibuk kota wisata ciwidey satu tidak kalah eksotis kawah putih rancaupas situ patenggang dasar catat sejarah kawah rengganis kawah sudah bentuk akibat proses alam juta tahun lalu dasar teliti kawah rengganis bentuk dahsyat letus gunung sunda purba khusus gunung patuha juga cipta kawah lain kawah putih bukti dahsyat letus kita lihat sendiri hingga ini di kawah rengganis cium kuat aroma bau belerang areal kawah cagar alam bandung
320,Pemandian Air Panas Cimanggu,Air Panas Cimanggu menjadi salah satu objek wisata di Bandung yang menawarkan berbagai macam daya tarik yang dijamin mengagumkan. Tempat wisata yang satu ini juga dikenal dengan nama Cimanggu Natural Hot Spring. Menikmati pemandian air panas dan juga hijaunya pemandangan di pemandian ini pastinya bisa membuat pikiran Anda lebih rileks. Pikiran rileks pastinya akan membuat Anda lebih bersemangat saat kembali bekerja.,Cagar Alam,Bandung,23000,39,60.0,"{'lat': -7.147152899999998, 'lng': 107.3901424}",-71471529,1073901424,,320,18,Pemandian Air Panas Cimanggu Air Panas Cimanggu menjadi salah satu objek wisata di Bandung yang menawarkan berbagai macam daya tarik yang dijamin mengagumkan. Tempat wisata yang satu ini juga dikenal dengan nama Cimanggu Natural Hot Spring. Menikmati pemandian air panas dan juga hijaunya pemandangan di pemandian ini pastinya bisa membuat pikiran Anda lebih rileks. Pikiran rileks pastinya akan membuat Anda lebih bersemangat saat kembali bekerja. Cagar Alam Bandung,mandi air panas cimanggu air panas cimanggu jadi salah satu objek wisata bandung tawar bagai macam daya tarik jamin kagum tempat wisata satu juga kenal nama cimanggu natural hot spring nikmat mandi air panas juga hijau pandang mandi pasti buat pikir lebih rileks pikir rileks pasti buat lebih semangat kembali kerja cagar alam bandung
321,Glamping Lakeside Rancabali,"Glamping Lakeside Rancabali menawarkan tempat berkemah mewah yang cocok untuk Anda jadikan destinasi liburan di akhir pekan. Seperti namanya, glamping atau glamour camping terdiri dari tenda yang berisikan tempat tidur nyaman, kamar mandi di dalam ruangan, pemanas, dan berbagai amenitas layaknya hotel berbintang. Berlokasi di Jalan Raya Ciwidey Rancabali KM 1, Glamping Lakeside berada di sekitar Situ Patenggang dan perkebunan teh yang subur. Tidak heran jika pemandangan dari glamping ini begitu apik dan Instagramable untuk berfoto.",Taman Hiburan,Bandung,30000,44,,"{'lat': -7.167590799999999, 'lng': 107.3532419}",-71675908,1073532419,,321,18,"Glamping Lakeside Rancabali Glamping Lakeside Rancabali menawarkan tempat berkemah mewah yang cocok untuk Anda jadikan destinasi liburan di akhir pekan. Seperti namanya, glamping atau glamour camping terdiri dari tenda yang berisikan tempat tidur nyaman, kamar mandi di dalam ruangan, pemanas, dan berbagai amenitas layaknya hotel berbintang. Berlokasi di Jalan Raya Ciwidey Rancabali KM 1, Glamping Lakeside berada di sekitar Situ Patenggang dan perkebunan teh yang subur. Tidak heran jika pemandangan dari glamping ini begitu apik dan Instagramable untuk berfoto. Taman Hiburan Bandung",glamping lakeside rancabali glamping lakeside rancabali tawar tempat kemah mewah cocok anda jadi destinasi libur akhir pekan nama glamping glamour camping diri tenda risi tempat tidur nyaman kamar mandi dalam ruang panas bagai amenitas layak hotel bintang lokasi jalan raya ciwidey rancabali km glamping lakeside ada sekitar situ patenggang kebun teh subur heran pandang glamping begitu apik instagramable foto taman hibur bandung
322,Bukit Jamur,"Bukit Jamur Ciwidey adalah satu dari sekian banyak pesona wisata alam yang berada di Kecamatan Ciwidey, Kabupaten Bandung, Provinsi Jawa barat. Bukit Jamur Ciwidey memang memiliki khas wisata Ciwidey, yaitu objek wisata di tengah hamparan kebun teh, dengan udara yang sangat sejuk.Suasana saat kabut turun di area perkebunan membuat suasana menjadi romatis. Bukit Jamur Ciwidey suasananya cocok juga bagi jomblowan – jomblowati, banyak spot dengan latar alam yang indah, yang dimungkinkan mampu melupakan sang mantan.",Cagar Alam,Bandung,0,42,,"{'lat': -7.195110199999998, 'lng': 107.4312811}",-71951102,1074312811,,322,27,"Bukit Jamur Bukit Jamur Ciwidey adalah satu dari sekian banyak pesona wisata alam yang berada di Kecamatan Ciwidey, Kabupaten Bandung, Provinsi Jawa barat. Bukit Jamur Ciwidey memang memiliki khas wisata Ciwidey, yaitu objek wisata di tengah hamparan kebun teh, dengan udara yang sangat sejuk.Suasana saat kabut turun di area perkebunan membuat suasana menjadi romatis. Bukit Jamur Ciwidey suasananya cocok juga bagi jomblowan – jomblowati, banyak spot dengan latar alam yang indah, yang dimungkinkan mampu melupakan sang mantan. Cagar Alam Bandung",bukit jamur bukit jamur ciwidey satu sekian banyak pesona wisata alam ada camat ciwidey kabupaten bandung provinsi jawa barat bukit jamur ciwidey memang milik khas wisata ciwidey objek wisata tengah hampar kebun teh udara sangat sejuk suasana kabut turun area kebun buat suasana jadi romatis bukit jamur ciwidey suasana cocok bagi jomblowan jomblowati banyak spot latar alam indah mungkin mampu lupa sang mantan cagar alam bandung
323,Kebun Tanaman Obat Sari Alam,"Kebun Tanaman Obat Sari Alam lebih terkenal dengan sebutan wisata pengobatan herbal, karena disana terdapat banyak sekali tanaman yang dijadikan sebagai pengobatan alternative. Kebun Tanaman Obat Sari Alam lebih dikenal oleh orang Bandung dengan sebutan KTO Sari Alam. Lokasi: Jl. Raya Ciwidey bandung km 26 no 8 rt 1 rw 2 kampung Andir, Cukanggenteng, Kec. Pasirjambu, kab Bandung, Jawa Barat 40972",Cagar Alam,Bandung,0,49,90.0,"{'lat': -6.601320999999999, 'lng': 106.632734}",-6601321,106632734,,323,31,"Kebun Tanaman Obat Sari Alam Kebun Tanaman Obat Sari Alam lebih terkenal dengan sebutan wisata pengobatan herbal, karena disana terdapat banyak sekali tanaman yang dijadikan sebagai pengobatan alternative. Kebun Tanaman Obat Sari Alam lebih dikenal oleh orang Bandung dengan sebutan KTO Sari Alam. Lokasi: Jl. Raya Ciwidey bandung km 26 no 8 rt 1 rw 2 kampung Andir, Cukanggenteng, Kec. Pasirjambu, kab Bandung, Jawa Barat 40972 Cagar Alam Bandung",kebun tanam obat sari alam kebun tanam obat sari alam lebih kenal sebut wisata obat herbal sana dapat banyak sekali tanam jadi obat alternative kebun tanam obat sari alam lebih kenal orang bandung sebut kto sari alam lokasi jl raya ciwidey bandung km no rt rw kampung andir cukanggenteng kec pasirjambu kab bandung jawa barat cagar alam bandung
324,Happyfarm Ciwidey,"Objek wisata alam dan edukasi tengah banyak menjamur akhir-akhir ini. Selain De Ranch dan Farmhouse Lembang, ada juga Happy Farm Ciwidey di Bandung. Objek wisata ini masih terbilang baru, karena baru bulan Juni 2019 ini berdiri. Konsepnya hampir sama, wisata alam dan peternakan dengan unsur edukasi. Sangat cocok menjadi tujuan wisata keluarga, terutama untuk anak-anak. Dan semakin seru karena bermain di area outdoor dengan udara sejuk._x000D_",Cagar Alam,Bandung,15000,42,90.0,"{'lat': -7.1147877, 'lng': 107.4380865}",-71147877,1074380865,,324,22,"Happyfarm Ciwidey Objek wisata alam dan edukasi tengah banyak menjamur akhir-akhir ini. Selain De Ranch dan Farmhouse Lembang, ada juga Happy Farm Ciwidey di Bandung. Objek wisata ini masih terbilang baru, karena baru bulan Juni 2019 ini berdiri. Konsepnya hampir sama, wisata alam dan peternakan dengan unsur edukasi. Sangat cocok menjadi tujuan wisata keluarga, terutama untuk anak-anak. Dan semakin seru karena bermain di area outdoor dengan udara sejuk._x000D_ Cagar Alam Bandung",happyfarm ciwidey objek wisata alam edukasi tengah banyak jamur akhir akhir selain de ranch farmhouse lembang juga happy farm ciwidey bandung objek wisata masih bilang baru baru bulan juni diri konsep hampir sama wisata alam terna unsur edukasi sangat cocok jadi tuju wisata keluarga utama anak anak makin seru main area outdoor udara sejuk x d cagar alam bandung
325,Saung Angklung Mang Udjo,"Saung Angklung Udjo (SAU) adalah suatu tempat yang merupakan tempat pertunjukan, pusat kerajinan tangan dari bambu, dan workshop instrumen musik dari bambu. Selain itu, SAU mempunyai tujuan sebagai laboratorium kependidikan dan pusat belajar untuk memelihara kebudayaan Sunda dan khususnya angklung. Didirikan pada tahun 1966 oleh Udjo Ngalagena dan istrinya Uum Sumiati, dengan maksud untuk melestarikan dan memelihara seni dan kebudayaan tradisional Sunda. Berlokasi di Jalan Padasuka 118, Bandung Timur Jawa Barat Indonesia. Dengan suasana tempat yang segar udaranya dan dikelilingi oleh pohon-pohon bambu, dari kerajinan bambu dan interior bambu sampai alat musik bambu. Disamping pertunjukan rutin setiap sore, Saung Angklung Udjo telah berkali-kali mengadakan pertunjukan khusus yang dilakukan pada pagi atau siang hari. Pertunjukkan tersebut tidak terbatas diadakan di lokasi Saung Angklung Udjo saja, tetapi berbagai undangan tampil di berbagai tempat baik di dalam maupun di luar negeri, pada bulan Agustus tahun 2000 di Sasana Budaya Ganesha ITB, Bandung, Saung Angklung Udjo mengadakan konser kolaborasi dengan penyanyi cilik yang dijuluki Shirley Temple-nya Indonesia, yaitu Sherina. Saung Angklung Udjo tidak terbatas pada hanya menjual seni pertunjukan saja, berbagai produk alat musik bambu tradisional (angklung, arumba, calung dan lainnya) dibuat dan dijual kepada para pembeli.",Budaya,Bandung,75000,47,,"{'lat': -6.897136199999999, 'lng': 107.6558466}",-68971362,1076558466,,325,27,"Saung Angklung Mang Udjo Saung Angklung Udjo (SAU) adalah suatu tempat yang merupakan tempat pertunjukan, pusat kerajinan tangan dari bambu, dan workshop instrumen musik dari bambu. Selain itu, SAU mempunyai tujuan sebagai laboratorium kependidikan dan pusat belajar untuk memelihara kebudayaan Sunda dan khususnya angklung. Didirikan pada tahun 1966 oleh Udjo Ngalagena dan istrinya Uum Sumiati, dengan maksud untuk melestarikan dan memelihara seni dan kebudayaan tradisional Sunda. Berlokasi di Jalan Padasuka 118, Bandung Timur Jawa Barat Indonesia. Dengan suasana tempat yang segar udaranya dan dikelilingi oleh pohon-pohon bambu, dari kerajinan bambu dan interior bambu sampai alat musik bambu. Disamping pertunjukan rutin setiap sore, Saung Angklung Udjo telah berkali-kali mengadakan pertunjukan khusus yang dilakukan pada pagi atau siang hari. Pertunjukkan tersebut tidak terbatas diadakan di lokasi Saung Angklung Udjo saja, tetapi berbagai undangan tampil di berbagai tempat baik di dalam maupun di luar negeri, pada bulan Agustus tahun 2000 di Sasana Budaya Ganesha ITB, Bandung, Saung Angklung Udjo mengadakan konser kolaborasi dengan penyanyi cilik yang dijuluki Shirley Temple-nya Indonesia, yaitu Sherina. Saung Angklung Udjo tidak terbatas pada hanya menjual seni pertunjukan saja, berbagai produk alat musik bambu tradisional (angklung, arumba, calung dan lainnya) dibuat dan dijual kepada para pembeli. Budaya Bandung",saung angklung mang udjo saung angklung udjo sau suatu tempat rupa tempat tunjuk pusat rajin tangan bambu workshop instrumen musik bambu itu sau punya tuju laboratorium didik pusat ajar pelihara budaya sunda khusus angklung diri tahun udjo ngalagena istri uum sumiati maksud lestari pelihara seni budaya tradisional sunda lokasi jalan padasuka bandung timur jawa barat indonesia suasana tempat segar udara keliling pohon pohon bambu rajin bambu interior bambu alat musik bambu samping tunjuk rutin sore saung angklung udjo kali kali ada tunjuk khusus laku pagi siang hari tunjuk sebut batas ada lokasi saung angklung udjo tetapi bagai undang tampil bagai tempat baik dalam maupun luar negeri bulan agustus tahun sasana budaya ganesha itb bandung saung angklung udjo ada konser kolaborasi nyanyi cilik juluk shirley temple nya indonesia sherina saung angklung udjo batas hanya jual seni tunjuk bagai produk alat musik bambu tradisional angklung arumba calung lain buat jual para beli budaya bandung
326,Taman Kupu-Kupu Cihanjuang,"Taman Kupu-Kupu Cihanjuang Bandung ini,sepertinya telah menambah daftar objek wisata di Bandung yang unik dan menarik seperti halnya theme park Jendela Alam Bandung sekaligus bernilai edukasi yang sangat tinggi buat anak-anak dan sebagai sarana pembelajaran kepada anak kita bahwa pelestarian hewan langka dan cantik ini bisa diajarkan sejak usia dini.Dan faktanya, meskipun relatif masih anyar, namun salah satu tempat wisata keluarga di bandung ini nyatanya berhasil banyak menarik atensi atau perhatian wisatawan lokal kota Bandung maupun wisatawan luar daerah yang sedang liburan di Bandung. Lokasi Tempat wisatanya yang memang masih sangat rindang dan sejuk, ditunjang lagi dengan design interior taman kupu-kupu yang ditata sangat begitu detil dan menarik. Apabila melancong ke kawasan wisata yang satu ini, diharapkan anak-anak anda bisa memperoleh informasi tentang bagaimana proses metamorfosis seekor kupu-kupu mulai dari bibit larva hingga tumbuh besar secara sempura.",Cagar Alam,Bandung,10000,4,,"{'lat': -6.8590047, 'lng': 107.568779}",-68590047,107568779,,326,20,"Taman Kupu-Kupu Cihanjuang Taman Kupu-Kupu Cihanjuang Bandung ini,sepertinya telah menambah daftar objek wisata di Bandung yang unik dan menarik seperti halnya theme park Jendela Alam Bandung sekaligus bernilai edukasi yang sangat tinggi buat anak-anak dan sebagai sarana pembelajaran kepada anak kita bahwa pelestarian hewan langka dan cantik ini bisa diajarkan sejak usia dini.Dan faktanya, meskipun relatif masih anyar, namun salah satu tempat wisata keluarga di bandung ini nyatanya berhasil banyak menarik atensi atau perhatian wisatawan lokal kota Bandung maupun wisatawan luar daerah yang sedang liburan di Bandung. Lokasi Tempat wisatanya yang memang masih sangat rindang dan sejuk, ditunjang lagi dengan design interior taman kupu-kupu yang ditata sangat begitu detil dan menarik. Apabila melancong ke kawasan wisata yang satu ini, diharapkan anak-anak anda bisa memperoleh informasi tentang bagaimana proses metamorfosis seekor kupu-kupu mulai dari bibit larva hingga tumbuh besar secara sempura. Cagar Alam Bandung",taman kupu kupu cihanjuang taman kupu kupu cihanjuang bandung seperti tambah daftar objek wisata bandung unik tarik hal theme park jendela alam bandung sekaligus nila edukasi sangat tinggi buat anak anak bagai sarana ajar anak bahwa lestari hewan langka cantik bisa ajar sejak usia dini fakta meski relatif anyar salah satu tempat wisata keluarga bandung nyata hasil banyak tarik atensi perhati wisatawan lokal kota bandung maupun wisatawan luar daerah sedang libur bandung lokasi tempat wisata memang sangat rindang sejuk tunjang dengan design interior taman kupu kupu tata sangat detil tarik apabila lancong kawasan wisata satu harap anak anak bisa oleh informasi bagaimana proses metamorfosis ekor kupu kupu mulai bibit larva hingga tumbuh besar sempura cagar alam bandung
