Place_Id,Place_Name,Description,Category,City,Price,Rating,Time_Minutes,Coordinate,Lat,Long,Column1,_1,Rating_Count,combined_text,clean_text
1,Monumen Nasional,"Monumen Nasional atau yang populer disingkat dengan Monas atau Tugu Monas adalah monumen peringatan setinggi 132 meter (433 kaki) yang didirikan untuk mengenang perlawanan dan perjuangan rakyat Indonesia untuk merebut kemerdekaan dari pemerintahan kolonial Hindia Belanda. Pembangunan monumen ini dimulai pada tanggal 17 Agustus 1961 di bawah perintah presiden Soekarno dan dibuka untuk umum pada tanggal 12 Juli 1975. Tugu ini dimahkotai lidah api yang dilapisi lembaran emas yang melambangkan semangat perjuangan yang menyala-nyala. Monumen Nasional terletak tepat di tengah Lapangan Medan Merdeka, Jakarta Pusat.",Budaya,Jakarta,20000,46,15.0,"{'lat': -6.1753924, 'lng': 106.8271528}",-61753924,1068271528,,1,18,"Monumen Nasional Monumen Nasional atau yang populer disingkat dengan Monas atau Tugu Monas adalah monumen peringatan setinggi 132 meter (433 kaki) yang didirikan untuk mengenang perlawanan dan perjuangan rakyat Indonesia untuk merebut kemerdekaan dari pemerintahan kolonial Hindia Belanda. Pembangunan monumen ini dimulai pada tanggal 17 Agustus 1961 di bawah perintah presiden Soekarno dan dibuka untuk umum pada tanggal 12 Juli 1975. Tugu ini dimahkotai lidah api yang dilapisi lembaran emas yang melambangkan semangat perjuangan yang menyala-nyala. Monumen Nasional terletak tepat di tengah Lapangan Medan Merdeka, Jakarta Pusat. Budaya Jakarta",monumen nasional monumen nasional populer singkat monas tugu monas monumen ingat setinggi meter kaki diri kenang lawan juang rakyat indonesia rebut merdeka perintah kolonial hindia belanda bangun monumen mulai tanggal agustus bawah perintah presiden soekarno buka umum tanggal juli tugu mahkota lidah api lapis lembar emas melambang semangat juang yang nyala nyala monumen nasional letak tepat tengah lapang medan merdeka jakarta pusat budaya jakarta
2,Kota Tua,"Kota tua di Jakarta, yang juga bernama Kota Tua, berpusat di Alun-Alun Fatahillah, yaitu alun-alun yang ramai dengan pertunjukan rutin tarian tradisional. Museum Sejarah Jakarta adalah bangunan era Belanda dengan lukisan dan barang antik, sedangkan Museum Wayang memamerkan boneka kayu khas Jawa. Desa Glodok, atau Chinatown, terkenal dengan makanan kaki lima, seperti pangsit dan mi goreng. Di dekatnya, terdapat sekunar dan kapal penangkap ikan di pelabuhan Sunda Kelapa yang kuno",Budaya,Jakarta,0,46,90.0,"{'lat': -6.137644799999999, 'lng': 106.8171245}",-61376448,1068171245,,2,25,"Kota Tua Kota tua di Jakarta, yang juga bernama Kota Tua, berpusat di Alun-Alun Fatahillah, yaitu alun-alun yang ramai dengan pertunjukan rutin tarian tradisional. Museum Sejarah Jakarta adalah bangunan era Belanda dengan lukisan dan barang antik, sedangkan Museum Wayang memamerkan boneka kayu khas Jawa. Desa Glodok, atau Chinatown, terkenal dengan makanan kaki lima, seperti pangsit dan mi goreng. Di dekatnya, terdapat sekunar dan kapal penangkap ikan di pelabuhan Sunda Kelapa yang kuno Budaya Jakarta",kota tua kota tua jakarta juga nama kota tua pusat alun alun fatahillah alun alun ramai tunjuk rutin tari tradisional museum sejarah jakarta bangun era belanda lukis barang antik museum wayang pamer boneka kayu khas jawa desa glodok chinatown kenal makan kaki lima pangsit mi goreng dekat dapat sekunar kapal tangkap ikan labuh sunda kelapa kuno budaya jakarta
3,Dunia Fantasi,"Dunia Fantasi atau disebut juga Dufan adalah tempat hiburan yang terletak di kawasan Taman Impian Jaya Ancol, Jakarta Utara, Indonesia. Dufan diresmikan dan dibuka pada tanggal 29 Agustus 1985.",Taman Hiburan,Jakarta,270000,46,360.0,"{'lat': -6.125312399999999, 'lng': 106.8335377}",-61253124,1068335377,,3,19,"Dunia Fantasi Dunia Fantasi atau disebut juga Dufan adalah tempat hiburan yang terletak di kawasan Taman Impian Jaya Ancol, Jakarta Utara, Indonesia. Dufan diresmikan dan dibuka pada tanggal 29 Agustus 1985. Taman Hiburan Jakarta",dunia fantasi dunia fantasi sebut dufan tempat hibur letak kawasan taman impi jaya ancol jakarta utara indonesia dufan resmi buka tanggal agustus taman hibur jakarta
4,Taman Mini Indonesia Indah (TMII),"Taman Mini Indonesia Indah merupakan suatu kawasan taman wisata bertema budaya Indonesia di Jakarta Timur. Area seluas kurang lebih 150 hektare atau 1,5 kilometer persegi ini terletak pada koordinat 6°18′6.8″LS,106°53′47.2″BT",Taman Hiburan,Jakarta,10000,45,,"{'lat': -6.302445899999999, 'lng': 106.8951559}",-63024459,1068951559,,4,21,"Taman Mini Indonesia Indah (TMII) Taman Mini Indonesia Indah merupakan suatu kawasan taman wisata bertema budaya Indonesia di Jakarta Timur. Area seluas kurang lebih 150 hektare atau 1,5 kilometer persegi ini terletak pada koordinat 6°18′6.8″LS,106°53′47.2″BT Taman Hiburan Jakarta",taman mini indonesia indah tmii taman mini indonesia indah rupa suatu kawasan taman wisata tema budaya indonesia jakarta timur area luas kurang lebih hektare kilometer persegi letak koordinat ls bt taman hibur jakarta
5,Atlantis Water Adventure,"Atlantis Water Adventure atau dikenal dengan Atlantis Ancol akan menyuguhkan petualangan wisata air tak terlupakan. Tempat Wisata bertemakan permainan air dengan luas 5 hektar ini memberi sensasi petualangan di 8 kolam utama. Yaitu kolam Antila, Plaza Atlas, Poseidon, Aquarius, Octopus, Kiddy Pool, dan Atlantean. Berlokasi di kawasan Ancol Jakarta Baycity, Atlantis bisa menjadi pilihan destinasi yang pas untuk wisata berenang.",Taman Hiburan,Jakarta,94000,45,60.0,"{'lat': -6.12419, 'lng': 106.839134}",-612419,106839134,,5,24,"Atlantis Water Adventure Atlantis Water Adventure atau dikenal dengan Atlantis Ancol akan menyuguhkan petualangan wisata air tak terlupakan. Tempat Wisata bertemakan permainan air dengan luas 5 hektar ini memberi sensasi petualangan di 8 kolam utama. Yaitu kolam Antila, Plaza Atlas, Poseidon, Aquarius, Octopus, Kiddy Pool, dan Atlantean. Berlokasi di kawasan Ancol Jakarta Baycity, Atlantis bisa menjadi pilihan destinasi yang pas untuk wisata berenang. Taman Hiburan Jakarta",atlantis water adventure atlantis water adventure kenal atlantis ancol suguh tualang wisata air tak lupa tempat wisata tema main air luas hektar beri sensasi tualang kolam utama kolam antila plaza atlas poseidon aquarius octopus kiddy pool atlantean lokasi kawasan ancol jakarta baycity atlantis jadi pilih destinasi pas wisata renang taman hibur jakarta
6,Taman Impian Jaya Ancol,Taman Impian Jaya Ancol merupakan sebuah objek wisata di Jakarta Utara.\n\n,Taman Hiburan,Jakarta,25000,45,10.0,"{'lat': -6.117333200000001, 'lng': 106.8579951}",-61173332,1068579951,,6,24,Taman Impian Jaya Ancol Taman Impian Jaya Ancol merupakan sebuah objek wisata di Jakarta Utara.\n\n Taman Hiburan Jakarta,taman impi jaya ancol taman impi jaya ancol rupa buah objek wisata jakarta utara n n taman hibur jakarta
7,Kebun Binatang Ragunan,"Kebun Binatang Ragunan adalah sebuah kebun binatang yang terletak di daerah Ragunan, Pasar Minggu, Jakarta Selatan, Indonesia. Kebun binatang seluas 140 hektare ini didirikan pada tahun 1864. Di dalamnya terdapat berbagai koleksi yang terdiri dari 295 spesies dan 4040 spesimen.\nRagunan sempat ditutup selama sekitar tiga minggu sejak 19 September 2005 karena hewan-hewan di dalamnya ada yang terinfeksi flu burung, tetapi dibuka kembali pada 11 Oktober 2005.Kebun binatang ini memiliki banyak spesies hewan yang langka antara lain kakatua, orangutan, gorila, anoa dan gajah",Cagar Alam,Jakarta,4000,45,,"{'lat': -6.3124593, 'lng': 106.8201865}",-63124593,1068201865,,7,22,"Kebun Binatang Ragunan Kebun Binatang Ragunan adalah sebuah kebun binatang yang terletak di daerah Ragunan, Pasar Minggu, Jakarta Selatan, Indonesia. Kebun binatang seluas 140 hektare ini didirikan pada tahun 1864. Di dalamnya terdapat berbagai koleksi yang terdiri dari 295 spesies dan 4040 spesimen.\nRagunan sempat ditutup selama sekitar tiga minggu sejak 19 September 2005 karena hewan-hewan di dalamnya ada yang terinfeksi flu burung, tetapi dibuka kembali pada 11 Oktober 2005.Kebun binatang ini memiliki banyak spesies hewan yang langka antara lain kakatua, orangutan, gorila, anoa dan gajah Cagar Alam Jakarta",kebun binatang ragunan kebun binatang ragunan buah kebun binatang letak daerah ragunan pasar minggu jakarta selatan indonesia kebun binatang luas hektare diri tahun dalam dapat bagai koleksi diri spesies spesimen nragunan sempat tutup lama tiga minggu sejak september hewan hewan dalam infeksi flu burung buka pada oktober kebun binatang milik banyak spesies hewan yang langka lain kakatua orangutan gorila anoa gajah cagar alam jakarta
8,Ocean Ecopark,"Ocean Ecopark Salah satu zona rekreasi Ancol yang menawarkan ruang terbuka hijau serta pengalaman dan tidak melupakan sisi pendidikan bagi para pengunjung. Beragam aktivitas dan wahana seru yang bisa dimainkan di tempat rekreasi keluarga, beberapa diantaranya : Outbondholic, Rumah Energy, Rumah Lebah, Kano, Paintball, Outbondholic, Eco-Market, Learning Farm, Eco-Bike, Faunaland. Kalau berencana berwisata ke Ocean Eco Park ancol tidak perlu khawatir dengan harga tiket masuknya. Karena harga tiket masuk Ocean Eco Park ditawarkan dengan harga yang masih terjangkau._x000D_",Taman Hiburan,Jakarta,180000,4,,"{'lat': -6.125801699999999, 'lng': 106.8363249}",-61258017,1068363249,,8,30,"Ocean Ecopark Ocean Ecopark Salah satu zona rekreasi Ancol yang menawarkan ruang terbuka hijau serta pengalaman dan tidak melupakan sisi pendidikan bagi para pengunjung. Beragam aktivitas dan wahana seru yang bisa dimainkan di tempat rekreasi keluarga, beberapa diantaranya : Outbondholic, Rumah Energy, Rumah Lebah, Kano, Paintball, Outbondholic, Eco-Market, Learning Farm, Eco-Bike, Faunaland. Kalau berencana berwisata ke Ocean Eco Park ancol tidak perlu khawatir dengan harga tiket masuknya. Karena harga tiket masuk Ocean Eco Park ditawarkan dengan harga yang masih terjangkau._x000D_ Taman Hiburan Jakarta",ocean ecopark ocean ecopark salah satu zona rekreasi ancol tawar ruang buka hijau alam lupa sisi didik para unjung agam aktivitas wahana seru bisa main tempat rekreasi keluarga beberapa antara outbondholic rumah energy rumah lebah kano paintball outbondholic eco market learning farm eco bike faunaland kalau rencana wisata ocean eco park ancol tidak perlu khawatir harga tiket masuk harga tiket masuk ocean eco park tawar harga masih jangkau x d taman hibur jakarta
9,Pelabuhan Marina,"Pelabuhan Marina Ancol berada di kawasan Taman Impian Jaya Ancol, Jakarta. Pelabuhan yang biasa disebut Dermaga Marina Ancol ini adalah kawasan yang tidak hanya untuk keperluan penyeberangan saja, tetapi juga dikembangkan untuk banyak hal, seperti wisata air, olahraga air maupun wahana bermain. Fungsi utama dari pelabuhan ini adalah untuk melayani para penumpang yang ingin menyeberang menuju ke kepulauan Seribu, begitu juga sebaliknya. Banyak orang yang berada di Jakarta dan sekitarnya, menjadikan kepulaun Seribu sebagai tujuan wisata yang utama. Liburan di Pulau Seribu memang mampu menghilangkan kepenatan bekerja di kota metropolitan, sembari menikmati keindahan pantai yang masih terjaga dengan baik. Marina Ancol berada di Jakarta Utara atau secara lengkap beralamat di Kota Tua, Ancol, Pademangan, Kota Jakarta. Sangat mudah menuju ke tempat ini karena tidak terlalu jauh dari pusat kota. Selain itu, ada banyak transportasi umum yang menuju ke tempat ini atau bisa juga menggunakan jasa transportasi online.",Bahari,Jakarta,175000,44,,"{'lat': 1.07888, 'lng': 103.931398}",107888,103931398,,9,19,"Pelabuhan Marina Pelabuhan Marina Ancol berada di kawasan Taman Impian Jaya Ancol, Jakarta. Pelabuhan yang biasa disebut Dermaga Marina Ancol ini adalah kawasan yang tidak hanya untuk keperluan penyeberangan saja, tetapi juga dikembangkan untuk banyak hal, seperti wisata air, olahraga air maupun wahana bermain. Fungsi utama dari pelabuhan ini adalah untuk melayani para penumpang yang ingin menyeberang menuju ke kepulauan Seribu, begitu juga sebaliknya. Banyak orang yang berada di Jakarta dan sekitarnya, menjadikan kepulaun Seribu sebagai tujuan wisata yang utama. Liburan di Pulau Seribu memang mampu menghilangkan kepenatan bekerja di kota metropolitan, sembari menikmati keindahan pantai yang masih terjaga dengan baik. Marina Ancol berada di Jakarta Utara atau secara lengkap beralamat di Kota Tua, Ancol, Pademangan, Kota Jakarta. Sangat mudah menuju ke tempat ini karena tidak terlalu jauh dari pusat kota. Selain itu, ada banyak transportasi umum yang menuju ke tempat ini atau bisa juga menggunakan jasa transportasi online. Bahari Jakarta",labuh marina labuh marina ancol ada kawasan taman impi jaya ancol jakarta labuh biasa sebut dermaga marina ancol adalah kawasan perlu seberang tetapi kembang banyak seperti wisata air olahraga air maupun wahana main fungsi utama labuh adalah untuk layan tumpang ingin seberang tuju pulau ribu juga balik banyak orang ada jakarta sekitar jadi kepulaun ribu tuju wisata utama libur pulau ribu memang mampu hilang penat kerja kota metropolitan sembari nikmat indah pantai masih jaga baik marina ancol ada jakarta utara cara lengkap alamat kota tua ancol pademangan kota jakarta sangat mudah tuju tempat karena tidak terlalu jauh pusat kota itu banyak transportasi umum tuju tempat atau juga guna jasa transportasi online bahari jakarta
10,Pulau Tidung,"Pulau Tidung adalah salah satu kelurahan di kecamatan Kepulauan Seribu Selatan, Kabupaten Kepulauan Seribu, Jakarta, Indonesia.",Bahari,Jakarta,150000,45,,"{'lat': -5.803205300000001, 'lng': 106.5237907}",-58032053,1065237907,,10,14,"Pulau Tidung Pulau Tidung adalah salah satu kelurahan di kecamatan Kepulauan Seribu Selatan, Kabupaten Kepulauan Seribu, Jakarta, Indonesia. Bahari Jakarta",pulau tidung pulau tidung salah satu lurah camat pulau ribu selatan kabupaten pulau ribu jakarta indonesia bahari jakarta
11,Pulau Bidadari,"Pulau Bidadari merupakan salah satu resor di Kabupaten Kepulauan Seribu, Jakarta. Sebelum bernama Pulau Bidadari, pulau ini memiliki dua nama yaitu Pulau Sakit dan Pulau Purmerend",Bahari,Jakarta,5000,46,,"{'lat': -6.035832999999999, 'lng': 106.746944}",-6035833,106746944,,11,24,"Pulau Bidadari Pulau Bidadari merupakan salah satu resor di Kabupaten Kepulauan Seribu, Jakarta. Sebelum bernama Pulau Bidadari, pulau ini memiliki dua nama yaitu Pulau Sakit dan Pulau Purmerend Bahari Jakarta",pulau bidadari pulau bidadari rupa salah satu resor kabupaten pulau ribu jakarta nama pulau bidadari pulau milik nama pulau sakit pulau purmerend bahari jakarta
12,Pulau Pari,"Pulau Pari adalah sebuah pulau yang terletak di Kepulauan Seribu di Daerah Khusus Ibukota Jakarta, Indonesia._x000D_",Bahari,Jakarta,150000,4,,"{'lat': -5.9074328, 'lng': 106.5863989}",-59074328,1065863989,,12,15,"Pulau Pari Pulau Pari adalah sebuah pulau yang terletak di Kepulauan Seribu di Daerah Khusus Ibukota Jakarta, Indonesia._x000D_ Bahari Jakarta",pulau pari pulau pari buah pulau letak pulau ribu daerah khusus ibukota jakarta indonesia x d bahari jakarta
13,Pulau Pramuka,Pulau Pramuka merupakan salah satu pulau yang berada dalam gugusan Kepulauan Seribu. Pulau ini merupakan pusat administrasi dan pemerintahan Kabupaten Administrasi Kepulauan Seribu. Pulau Pramuka termasuk ke dalam wilayah Kelurahan Pulau Panggang.,Bahari,Jakarta,5000,42,,"{'lat': -5.745962, 'lng': 106.6136577}",-5745962,1066136577,,13,25,Pulau Pramuka Pulau Pramuka merupakan salah satu pulau yang berada dalam gugusan Kepulauan Seribu. Pulau ini merupakan pusat administrasi dan pemerintahan Kabupaten Administrasi Kepulauan Seribu. Pulau Pramuka termasuk ke dalam wilayah Kelurahan Pulau Panggang. Bahari Jakarta,pulau pramuka pulau pramuka rupa salah satu pulau ada gugus pulau ribu pulau rupa pusat administrasi perintah kabupaten administrasi pulau ribu pulau pramuka masuk dalam wilayah lurah pulau panggang bahari jakarta
14,Pulau Pelangi,"Pulau Pelangi adalah sebuah pulau yang terletak di Kepulauan Seribu di Daerah Khusus Ibukota Jakarta, Indonesia. Pulau Pelangi adalah sebuah pulau yang terletak di Kepulauan Seribu di Daerah Khusus Ibukota Jakarta, Indonesia, Pulau Pelangi / biasa disebut Pulau Petondan Besar ( Pelangi Island ) merupakan pulau resort yang sesuai untuk berlibur. Pulau Resort ini mempunyai konsep natural, karena sebagian wilayahnya di penuhi dengan rerimbunan pohon yang menyejukan mata, Keindahan alam dan lautnya layak untuk dikunjungi. Dikelilingi oleh rimbunan pohon dan laut berwarana biru jernih membuat suasanan sejuk dan nyaman. Kondisi yang ideal untuk wisata bersama keluarga. Dengan akomodasi yang langsung menghadap ke laut membuat turis betah berlama-lama di Pulau Pelangi.\nMenurut informasi, Pulau Pelangi atau Pulau Petondan Besar merupakan pulau yang berada pada gugusan Kepulauan Seribu. Secara administratif termasuk dalam wilayah Kabupaten Administratif Kepulauan Seribu provinsi DKI Jakarta. Bersamaan dengan Pulau Petondan Kecil merupakan sebuah resort berlibur. Letaknya berdekatan dengan gugusan yang sama dengan Pulau Kelor dan Pulau Kelapa.\nUntuk mencapai Pelangi Resort dibutuhkan waktu 90 menit perjalanan dari dermaga Pantai Mutiara. Terdapat kapal speedboat khusus di pier R1 Pantai Mutiara yang membawa penumpang kesana. Letaknya 60 – 70 km dari Pantai Mutiara memang lumayan jauh. Namun perjalanan anda terbayar lunas begitu sampai di Pulau Pelangi._x000D_",Bahari,Jakarta,900000,48,,"{'lat': -5.587055, 'lng': 106.5885}",-5587055,1065885,,14,18,"Pulau Pelangi Pulau Pelangi adalah sebuah pulau yang terletak di Kepulauan Seribu di Daerah Khusus Ibukota Jakarta, Indonesia. Pulau Pelangi adalah sebuah pulau yang terletak di Kepulauan Seribu di Daerah Khusus Ibukota Jakarta, Indonesia, Pulau Pelangi / biasa disebut Pulau Petondan Besar ( Pelangi Island ) merupakan pulau resort yang sesuai untuk berlibur. Pulau Resort ini mempunyai konsep natural, karena sebagian wilayahnya di penuhi dengan rerimbunan pohon yang menyejukan mata, Keindahan alam dan lautnya layak untuk dikunjungi. Dikelilingi oleh rimbunan pohon dan laut berwarana biru jernih membuat suasanan sejuk dan nyaman. Kondisi yang ideal untuk wisata bersama keluarga. Dengan akomodasi yang langsung menghadap ke laut membuat turis betah berlama-lama di Pulau Pelangi.\nMenurut informasi, Pulau Pelangi atau Pulau Petondan Besar merupakan pulau yang berada pada gugusan Kepulauan Seribu. Secara administratif termasuk dalam wilayah Kabupaten Administratif Kepulauan Seribu provinsi DKI Jakarta. Bersamaan dengan Pulau Petondan Kecil merupakan sebuah resort berlibur. Letaknya berdekatan dengan gugusan yang sama dengan Pulau Kelor dan Pulau Kelapa.\nUntuk mencapai Pelangi Resort dibutuhkan waktu 90 menit perjalanan dari dermaga Pantai Mutiara. Terdapat kapal speedboat khusus di pier R1 Pantai Mutiara yang membawa penumpang kesana. Letaknya 60 – 70 km dari Pantai Mutiara memang lumayan jauh. Namun perjalanan anda terbayar lunas begitu sampai di Pulau Pelangi._x000D_ Bahari Jakarta",pulau pelangi pulau pelangi buah pulau letak pulau ribu daerah khusus ibukota jakarta indonesia pulau pelangi buah pulau letak pulau ribu daerah khusus ibukota jakarta indonesia pulau pelangi biasa sebut pulau petondan besar pelangi island rupa pulau resort sesuai libur pulau resort punya konsep natural bagi wilayah penuh rimbun pohon sejuk mata indah alam laut layak kunjung keliling rimbun pohon laut berwarana biru jernih buat suasanan sejuk nyaman kondisi ideal wisata sama keluarga akomodasi langsung hadap laut buat turis betah lama lama pulau pelangi nmenurut informasi pulau pelangi pulau petondan besar rupa pulau ada gugus pulau ribu administratif masuk wilayah kabupaten administratif pulau ribu provinsi dki jakarta sama pulau petondan kecil rupa buah resort libur letak dekat gugus sama pulau kelor pulau kelapa nuntuk capai pelangi resort butuh waktu menit jalan dermaga pantai mutiara dapat kapal speedboat khusus pier r pantai mutiara bawa tumpang kesana letak km pantai mutiara memang lumayan jauh jalan bayar lunas sampai pulau pelangi x d bahari jakarta
15,Pasar Seni,"Pasar Seni merupakan Pusat kerajinan dan kesenian yang menjadi wadah bagi seniman berbakat untuk menyalurkan kerajinan seni yang mereka miliki. Seniman dapat bertemu dengan para kolektor seni dan pengusaha untuk saling berbagi informasi dan memasarkan produk yang dimiliki. Didirikan awal tahun 1977, dengan peletakan batu pertama oleh Bang Ali Sadikin, Gubernur pertama DKI Jakarta, tepatnya pada bulan Juli 1977. Dan diresmikan oleh Gubernur H. Tjokropanolo pada tanggal 17 Desember 1977. Sejak diresmikan Pasar Seni, mendapat sambutan positif bagi pada pecinta seni yang ada.",Pusat Perbelanjaan,Jakarta,0,44,90.0,"{'lat': -6.1766868, 'lng': 106.8417666}",-61766868,1068417666,,15,25,"Pasar Seni Pasar Seni merupakan Pusat kerajinan dan kesenian yang menjadi wadah bagi seniman berbakat untuk menyalurkan kerajinan seni yang mereka miliki. Seniman dapat bertemu dengan para kolektor seni dan pengusaha untuk saling berbagi informasi dan memasarkan produk yang dimiliki. Didirikan awal tahun 1977, dengan peletakan batu pertama oleh Bang Ali Sadikin, Gubernur pertama DKI Jakarta, tepatnya pada bulan Juli 1977. Dan diresmikan oleh Gubernur H. Tjokropanolo pada tanggal 17 Desember 1977. Sejak diresmikan Pasar Seni, mendapat sambutan positif bagi pada pecinta seni yang ada. Pusat Perbelanjaan Jakarta",pasar seni pasar seni rupa pusat rajin seni jadi wadah seniman bakat salur rajin seni mereka milik seniman temu para kolektor seni usaha saling bagi informasi pasar produk milik diri awal tahun leta batu pertama bang ali sadikin gubernur pertama dki jakarta tepat bulan juli resmi gubernur h tjokropanolo tanggal desember sejak resmi pasar seni dapat sambut positif pada cinta seni ada pusat belanja jakarta
16,Jembatan Kota Intan,"Jembatan Kota Intan adalah jembatan tertua di Indonesia yang dibangun pada tahun 1628 oleh pemerintah Vereenigde Oostindische Compagnie atau VOC, atau masyarakat kita lebih familiar dengan sebutan Kumpeni. Jembatan itu kini terletak di Kali Besar kawasan Kota Tua wilayah Jakarta Barat dan berada di bawah pengelolaan Dinas Pariwisata dan Kebudayaan Provinsi DKI Jakarta.",Budaya,Jakarta,0,43,,"{'lat': -6.1314572, 'lng': 106.8106169}",-61314572,1068106169,,16,21,"Jembatan Kota Intan Jembatan Kota Intan adalah jembatan tertua di Indonesia yang dibangun pada tahun 1628 oleh pemerintah Vereenigde Oostindische Compagnie atau VOC, atau masyarakat kita lebih familiar dengan sebutan Kumpeni. Jembatan itu kini terletak di Kali Besar kawasan Kota Tua wilayah Jakarta Barat dan berada di bawah pengelolaan Dinas Pariwisata dan Kebudayaan Provinsi DKI Jakarta. Budaya Jakarta",jembatan kota intan jembatan kota intan jembatan tua indonesia bangun tahun perintah vereenigde oostindische compagnie voc masyarakat lebih familiar sebut kumpeni jembatan kini letak kali besar kawasan kota tua wilayah jakarta barat ada bawah kelola dinas pariwisata budaya provinsi dki jakarta budaya jakarta
17,Museum Fatahillah,"Museum Fatahillah memiliki nama resmi Museum Sejarah Jakarta adalah sebuah museum yang terletak di Jalan Taman Fatahillah No. 1, Jakarta Barat dengan luas lebih dari 1.300 meter persegi.\nBangunan ini dahulu merupakan balai kota Batavia (bahasa Belanda: Stadhuis van Batavia) yang dibangun pada tahun 1707-1710 atas perintah Gubernur-Jendral Joan van Hoorn. Bangunan ini menyerupai Istana Dam di Amsterdam, terdiri atas bangunan utama dengan dua sayap di bagian timur dan barat serta bangunan sanding yang digunakan sebagai kantor, ruang pengadilan, dan ruang-ruang bawah tanah yang dipakai sebagai penjara. Pada tanggal 30 Maret 1974, bangunan ini kemudian diresmikan oleh bapak Ali Sadikin sebagai Museum Sejarah Jakarta.",Budaya,Jakarta,5000,44,,"{'lat': -6.136448899999999, 'lng': 106.8130661}",-61364489,1068130661,,17,28,"Museum Fatahillah Museum Fatahillah memiliki nama resmi Museum Sejarah Jakarta adalah sebuah museum yang terletak di Jalan Taman Fatahillah No. 1, Jakarta Barat dengan luas lebih dari 1.300 meter persegi.\nBangunan ini dahulu merupakan balai kota Batavia (bahasa Belanda: Stadhuis van Batavia) yang dibangun pada tahun 1707-1710 atas perintah Gubernur-Jendral Joan van Hoorn. Bangunan ini menyerupai Istana Dam di Amsterdam, terdiri atas bangunan utama dengan dua sayap di bagian timur dan barat serta bangunan sanding yang digunakan sebagai kantor, ruang pengadilan, dan ruang-ruang bawah tanah yang dipakai sebagai penjara. Pada tanggal 30 Maret 1974, bangunan ini kemudian diresmikan oleh bapak Ali Sadikin sebagai Museum Sejarah Jakarta. Budaya Jakarta",museum fatahillah museum fatahillah milik nama resmi museum sejarah jakarta buah museum letak jalan taman fatahillah no jakarta barat luas lebih meter persegi nbangunan dahulu rupa balai kota batavia bahasa belanda stadhuis van batavia bangun tahun atas perintah gubernur jendral joan van hoorn bangun rupa istana dam amsterdam diri atas bangun utama dua sayap bagi timur barat bangun sanding guna kantor ruang adil ruang ruang bawah tanah pakai penjara tanggal maret bangun kemudian resmi bapak ali sadikin museum sejarah jakarta budaya jakarta
