Place_Id,Place_Name,Description,Category,City,Price,Rating,Time_Minutes,Coordinate,Lat,Long,Column1,_1,Rating_Count,combined_text,clean_text
121,Candi Prambanan,"Candi Prambanan atau Candi Roro Jonggrang (bahasa Jawa: ꦕꦤ꧀ꦝꦶ​ꦥꦿꦩ꧀ꦧꦤꦤ꧀, translit. Candhi Prambanan) adalah kompleks candi Hindu terbesar di Indonesia yang dibangun pada abad ke-9 masehi. Candi ini dipersembahkan untuk Trimurti, tiga dewa utama Hindu yaitu Brahma sebagai dewa pencipta, Wisnu sebagai dewa pemelihara, dan Siwa sebagai dewa pemusnah. Berdasarkan prasasti Siwagrha nama asli kompleks candi ini adalah Siwagrha (bahasa Sanskerta yang bermakna 'Rumah Siwa'), dan memang di garbagriha (ruang utama) candi ini bersemayam arca Siwa Mahadewa setinggi tiga meter yang menujukkan bahwa di candi ini dewa Siwa lebih diutamakan.\nKompleks percandian Candi Prambanan secara keseluruhan berada di wilayah provinsi Daerah Istimewa Yogyakarta, namun pintu administrasinya berada di Daerah Istimewa Surakarta (sekarang bagian Provinsi Jawa Tengah), hal ini yang membuat Candi Prambanan terletak di 2 tempat yakni di Desa Bokoharjo, Kecamatan Prambanan, Kabupaten Sleman, dan di Desa Tlogo, Kecamatan Prambanan, Kabupaten Klaten, atau kurang lebih 17 kilometer timur laut Yogyakarta, 50 kilometer barat daya Surakarta dan 120 kilometer selatan Semarang, persis di perbatasan antara Daerah Istimewa Yogyakarta dan Daerah Istimewa Surakarta.Candi ini adalah termasuk Situs Warisan Dunia UNESCO, candi Hindu terbesar di Indonesia, sekaligus salah satu candi terindah di Asia Tenggara. Arsitektur bangunan ini berbentuk tinggi dan ramping sesuai dengan arsitektur Hindu pada umumnya dengan candi Siwa sebagai candi utama memiliki ketinggian mencapai 47 meter menjulang di tengah kompleks gugusan candi-candi yang lebih kecil. Sebagai salah satu candi termegah di Asia Tenggara, candi Prambanan menjadi daya tarik kunjungan wisatawan dari seluruh dunia.Menurut prasasti Siwagrha, candi ini mulai dibangun pada sekitar tahun 850 masehi oleh Rakai Pikatan, dan terus dikembangkan dan diperluas oleh Balitung Maha Sambu, pada masa kerajaan Medang Mataram.",Budaya,Yogyakarta,50000,47,,"{'lat': -7.752020600000001, 'lng': 110.4914674}",-77520206,1104914674,,121,20,"Candi Prambanan Candi Prambanan atau Candi Roro Jonggrang (bahasa Jawa: ꦕꦤ꧀ꦝꦶ​ꦥꦿꦩ꧀ꦧꦤꦤ꧀, translit. Candhi Prambanan) adalah kompleks candi Hindu terbesar di Indonesia yang dibangun pada abad ke-9 masehi. Candi ini dipersembahkan untuk Trimurti, tiga dewa utama Hindu yaitu Brahma sebagai dewa pencipta, Wisnu sebagai dewa pemelihara, dan Siwa sebagai dewa pemusnah. Berdasarkan prasasti Siwagrha nama asli kompleks candi ini adalah Siwagrha (bahasa Sanskerta yang bermakna 'Rumah Siwa'), dan memang di garbagriha (ruang utama) candi ini bersemayam arca Siwa Mahadewa setinggi tiga meter yang menujukkan bahwa di candi ini dewa Siwa lebih diutamakan.\nKompleks percandian Candi Prambanan secara keseluruhan berada di wilayah provinsi Daerah Istimewa Yogyakarta, namun pintu administrasinya berada di Daerah Istimewa Surakarta (sekarang bagian Provinsi Jawa Tengah), hal ini yang membuat Candi Prambanan terletak di 2 tempat yakni di Desa Bokoharjo, Kecamatan Prambanan, Kabupaten Sleman, dan di Desa Tlogo, Kecamatan Prambanan, Kabupaten Klaten, atau kurang lebih 17 kilometer timur laut Yogyakarta, 50 kilometer barat daya Surakarta dan 120 kilometer selatan Semarang, persis di perbatasan antara Daerah Istimewa Yogyakarta dan Daerah Istimewa Surakarta.Candi ini adalah termasuk Situs Warisan Dunia UNESCO, candi Hindu terbesar di Indonesia, sekaligus salah satu candi terindah di Asia Tenggara. Arsitektur bangunan ini berbentuk tinggi dan ramping sesuai dengan arsitektur Hindu pada umumnya dengan candi Siwa sebagai candi utama memiliki ketinggian mencapai 47 meter menjulang di tengah kompleks gugusan candi-candi yang lebih kecil. Sebagai salah satu candi termegah di Asia Tenggara, candi Prambanan menjadi daya tarik kunjungan wisatawan dari seluruh dunia.Menurut prasasti Siwagrha, candi ini mulai dibangun pada sekitar tahun 850 masehi oleh Rakai Pikatan, dan terus dikembangkan dan diperluas oleh Balitung Maha Sambu, pada masa kerajaan Medang Mataram. Budaya Yogyakarta",candi prambanan candi prambanan candi roro jonggrang bahasa jawa translit candhi prambanan kompleks candi hindu besar indonesia bangun abad masehi candi sembah trimurti tiga dewa utama hindu brahma dewa cipta wisnu dewa pelihara siwa dewa musnah dasar prasasti siwagrha nama asli kompleks candi adalah siwagrha bahasa sanskerta makna rumah siwa memang garbagriha ruang utama candi semayam arca siwa mahadewa setinggi tiga meter menujukkan candi dewa siwa lebih utama nkompleks candi candi prambanan seluruh ada wilayah provinsi daerah istimewa yogyakarta pintu administrasi ada daerah istimewa surakarta sekarang bagi provinsi jawa tengah buat candi prambanan letak tempat desa bokoharjo camat prambanan kabupaten sleman desa tlogo camat prambanan kabupaten klaten kurang lebih kilometer timur laut yogyakarta kilometer barat daya surakarta kilometer selatan semarang persis batas daerah istimewa yogyakarta daerah istimewa surakarta candi adalah masuk situs waris dunia unesco candi hindu besar indonesia sekaligus salah satu candi indah di asia tenggara arsitektur bangun bentuk tinggi ramping sesuai arsitektur hindu umum candi siwa candi utama milik tinggi capai meter julang di tengah kompleks gugus candi candi lebih kecil salah satu candi megah di asia tenggara candi prambanan jadi daya tarik kunjung wisatawan seluruh dunia prasasti siwagrha candi ini mulai bangun sekitar tahun masehi raka pikat terus kembang luas balitung maha sambu masa raja medang mataram budaya yogyakarta
122,Watu Goyang,"Watu Goyang ini berasal dari Bahasa Jawa yang berarti Batu yang bergoyang. Dulunya di tempat ini terdapat batu yang berada di puncak yang bias bergoyang ketika disentuh maupun didorong. Batu tersebut sudah ada sejak ratuhan tahun yang lalu. Para pengelola menjelaskan bahwa Watu Goyang ini tidak pernah roboh walaupun disetuh bahkan di panjat, tetapi pihak pengelola melarang kesar untuk pengunjung yang mencoba menaiki Watu Goyang tersebut karena akan sangat berbahaya bagi keselamatan. Keunikan dari batu raksasa itu adalah stukturnya yang memuat tonjolan-tonjolan yang unik. Pemandangan alam yang masih hijau dan gunung merapi terlihat sangat alami, sangat cocok bagi para pengunjung untuk menghilangkan rasa bosan dengan aktivitas sehari-hari di perkotaan. Berada di puncak ini pengunjung akan merasakan sejuknya suhu udara, terutama pada pagi hari. Dan ketika di siang hari, meskipun cuaca sedang panas, maka hembusan angin yang menyapa terasa segar dan nyaman.",Budaya,Yogyakarta,2500,44,45.0,"{'lat': -7.9274086, 'lng': 110.4120586}",-79274086,1104120586,,122,18,"Watu Goyang Watu Goyang ini berasal dari Bahasa Jawa yang berarti Batu yang bergoyang. Dulunya di tempat ini terdapat batu yang berada di puncak yang bias bergoyang ketika disentuh maupun didorong. Batu tersebut sudah ada sejak ratuhan tahun yang lalu. Para pengelola menjelaskan bahwa Watu Goyang ini tidak pernah roboh walaupun disetuh bahkan di panjat, tetapi pihak pengelola melarang kesar untuk pengunjung yang mencoba menaiki Watu Goyang tersebut karena akan sangat berbahaya bagi keselamatan. Keunikan dari batu raksasa itu adalah stukturnya yang memuat tonjolan-tonjolan yang unik. Pemandangan alam yang masih hijau dan gunung merapi terlihat sangat alami, sangat cocok bagi para pengunjung untuk menghilangkan rasa bosan dengan aktivitas sehari-hari di perkotaan. Berada di puncak ini pengunjung akan merasakan sejuknya suhu udara, terutama pada pagi hari. Dan ketika di siang hari, meskipun cuaca sedang panas, maka hembusan angin yang menyapa terasa segar dan nyaman. Budaya Yogyakarta",watu goyang watu goyang asal bahasa jawa arti batu goyang tempat dapat batu ada puncak bias goyang sentuh maupun dorong batu sebut ada sejak ratuhan tahun lalu kelola jelas watu goyang tidak pernah roboh walaupun disetuh bahkan panjat pihak kelola larang sar unjung coba naik watu goyang sebut sangat bahaya selamat uni batu raksasa adalah stukturnya muat tonjol tonjol unik pandang alam masih hijau gunung rapi lihat sangat alami sangat cocok para unjung hilang rasa bosan aktivitas hari hari kota ada puncak unjung akan rasa sejuk suhu udara utama pagi hari ketika di siang hari meski cuaca sedang panas hembus angin sapa asa segar nyaman budaya yogyakarta
123,Kampung Wisata Rejowinangun,"Kampung wisata Rejowinangun terletak di Kelurahan rejowinangun, Kecamatan Kotagede, Kota Yogyakarta tepatnya sebelah selatan Kebun binatang Gembiraloka. Kampung wisata ini telah dirintis sejak tahun 2010 dan dengan kerjasama seluruh elemen masyarakat, pada tanggal 04 Oktober 2013 oleh Kepala dinas Pariwisata Kota Yogyakarta, Kampung Wisata Rejowinangun diresmikan. Kelurahan Rejowinangun merupakan satu kelurahan dari tiga kelurahan yang ada di Kecamatan Kotagede, sebuah kecamatan diujung timur Kota Yogyakarta yang terkenal dengan perak dan bekas kerajaan Mataram. Kelurahan Rejowinangun memiliki banyak potensi yang jika dikembangkan sungguh akan sangat luar biasa, meskpun saat ini yang terkenal baru Kebun Raya Kebun Binatang (KRKB) Gembiraloka yang lokasinya berada di wilayah Kelurahan Rejowinangun. Dengan adanya tempat wisata KRKB Gembiraloka di wilayah ini, berusaha mengembangkan wilayah kelurahan dengan potensi yang ada sehingga wisatawan selain mengunjungi Gembiraloka bisa singgah di kampung wisata ini._x000D_",Budaya,Yogyakarta,0,43,,"{'lat': -7.8152776, 'lng': 110.3988359}",-78152776,1103988359,,123,20,"Kampung Wisata Rejowinangun Kampung wisata Rejowinangun terletak di Kelurahan rejowinangun, Kecamatan Kotagede, Kota Yogyakarta tepatnya sebelah selatan Kebun binatang Gembiraloka. Kampung wisata ini telah dirintis sejak tahun 2010 dan dengan kerjasama seluruh elemen masyarakat, pada tanggal 04 Oktober 2013 oleh Kepala dinas Pariwisata Kota Yogyakarta, Kampung Wisata Rejowinangun diresmikan. Kelurahan Rejowinangun merupakan satu kelurahan dari tiga kelurahan yang ada di Kecamatan Kotagede, sebuah kecamatan diujung timur Kota Yogyakarta yang terkenal dengan perak dan bekas kerajaan Mataram. Kelurahan Rejowinangun memiliki banyak potensi yang jika dikembangkan sungguh akan sangat luar biasa, meskpun saat ini yang terkenal baru Kebun Raya Kebun Binatang (KRKB) Gembiraloka yang lokasinya berada di wilayah Kelurahan Rejowinangun. Dengan adanya tempat wisata KRKB Gembiraloka di wilayah ini, berusaha mengembangkan wilayah kelurahan dengan potensi yang ada sehingga wisatawan selain mengunjungi Gembiraloka bisa singgah di kampung wisata ini._x000D_ Budaya Yogyakarta",kampung wisata rejowinangun kampung wisata rejowinangun letak lurah rejowinangun camat kotagede kota yogyakarta tepat belah selatan kebun binatang gembiraloka kampung wisata telah rintis sejak tahun kerjasama seluruh elemen masyarakat tanggal oktober kepala dinas pariwisata kota yogyakarta kampung wisata rejowinangun resmi lurah rejowinangun rupa satu lurah tiga lurah ada camat kotagede buah camat ujung timur kota yogyakarta kenal perak bekas raja mataram lurah rejowinangun milik banyak potensi jika kembang sungguh sangat luar biasa meskpun kenal baru kebun raya kebun binatang krkb gembiraloka lokasi ada wilayah lurah rejowinangun ada tempat wisata krkb gembiraloka wilayah usaha kembang wilayah lurah dengan potensi ada wisatawan unjung gembiraloka singgah kampung wisata ini x d budaya yogyakarta
124,Kauman Pakualaman Yogyakarta,"Pakualaman adalah sebuah kecamatan di Kota Yogyakarta, Provinsi Daerah Istimewa Yogyakarta, Indonesia. Kecamatan ini terletak di antara Sungai Code dan Sungai Manunggal. Nama 'Pakualaman' diambil dari Puro Paku Alaman, kediaman resmi Sri Paduka Pakualam yang terletak tepat di tengah-tengah kecamatan ini. Sebelumnya, Pakualaman bukan bagian kota Yogyakarta, melainkan Kabupaten Kota Pakualaman, yang dihapus setelah terbentuknya Pemerintah Kota Yogyakarta pada 1947._x000D_",Budaya,Yogyakarta,0,5,,"{'lat': -7.801034700000001, 'lng': 110.3751922}",-78010347,1103751922,,124,13,"Kauman Pakualaman Yogyakarta Pakualaman adalah sebuah kecamatan di Kota Yogyakarta, Provinsi Daerah Istimewa Yogyakarta, Indonesia. Kecamatan ini terletak di antara Sungai Code dan Sungai Manunggal. Nama 'Pakualaman' diambil dari Puro Paku Alaman, kediaman resmi Sri Paduka Pakualam yang terletak tepat di tengah-tengah kecamatan ini. Sebelumnya, Pakualaman bukan bagian kota Yogyakarta, melainkan Kabupaten Kota Pakualaman, yang dihapus setelah terbentuknya Pemerintah Kota Yogyakarta pada 1947._x000D_ Budaya Yogyakarta",kaum pakualaman yogyakarta pakualaman buah camat kota yogyakarta provinsi daerah istimewa yogyakarta indonesia camat letak antara sungai code sungai manunggal nama pakualaman ambil puro paku alam diam resmi sri paduka pakualam letak tepat tengah tengah camat belum pakualaman bukan bagi kota yogyakarta kabupaten kota pakualaman hapus bentuk perintah kota yogyakarta x d budaya yogyakarta
125,Alun-alun Utara Keraton Yogyakarta,Alun-alun utara atau dalam Bahasa Jawa disebut Alun-alun Lor merupakan salah satu land mark Kota Yogyakarta yang berupa sebuah tanah lapang yang berada di depan Keraton Yogyakarta. Disebut Alun-alun Lor karena di Kota Yogyakarta terdapat dua alun-alun yang letaknya di sebelah selatan dan utara dari Keraton Yogyakarta. Alun-alun Lor berbentuk persegi dengan luas 150 x 150 meter dengan dua pohon beringin besar berpagar yang berada di tengah alun-alun. Dua Pohon Beringin Besar itu masing-masing diberi nama Kyai Dewandaru dan Kyai Wijayandaru. Pada masa lalu di sekeliling Alun-alun Lor ditanam 63 Pohon Beringin yang melambangkan umur Nabi Muhammad SAW.,Budaya,Yogyakarta,0,46,60.0,"{'lat': -7.803897499999998, 'lng': 110.3644232}",-78038975,1103644232,,125,17,Alun-alun Utara Keraton Yogyakarta Alun-alun utara atau dalam Bahasa Jawa disebut Alun-alun Lor merupakan salah satu land mark Kota Yogyakarta yang berupa sebuah tanah lapang yang berada di depan Keraton Yogyakarta. Disebut Alun-alun Lor karena di Kota Yogyakarta terdapat dua alun-alun yang letaknya di sebelah selatan dan utara dari Keraton Yogyakarta. Alun-alun Lor berbentuk persegi dengan luas 150 x 150 meter dengan dua pohon beringin besar berpagar yang berada di tengah alun-alun. Dua Pohon Beringin Besar itu masing-masing diberi nama Kyai Dewandaru dan Kyai Wijayandaru. Pada masa lalu di sekeliling Alun-alun Lor ditanam 63 Pohon Beringin yang melambangkan umur Nabi Muhammad SAW. Budaya Yogyakarta,alun alun utara keraton yogyakarta alun alun utara dalam bahasa jawa sebut alun alun lor rupa salah satu land mark kota yogyakarta upa buah tanah lapang ada depan keraton yogyakarta sebut alun alun lor kota yogyakarta dapat alun alun letak belah selatan utara keraton yogyakarta alun alun lor bentuk persegi luas x meter pohon beringin besar pagar ada tengah alun alun dua pohon beringin besar masing masing beri nama kyai dewandaru kyai wijayandaru masa lalu di keliling alun alun lor tanam pohon beringin melambang umur nabi muhammad saw budaya yogyakarta
126,Pantai Goa Cemara,"Pantai Goa Cemara (bahasa Jawa: ꦥꦱꦶꦱꦶꦂ​ ꦒꦸꦮ​ ꦕꦺꦩꦫ, translit. Pasisir Guwa Cemara​) adalah objek wisata pantai yang terletak di Dusun Patihan, Desa Gadingsari, Kecamatan Sanden, Kabupaten Bantul. Daerah Istimewa Yogyakarta. Pantai ini terletak tepatnya berdampingan dengan Pantai Samas dan Pantai Pandansari.\n\nPantai ini memiliki pasir berwarna hitam tapi lembut dengan ombak yang cukup besar kerakteristik pantai selatan. Pantai ini merupakan pantai pengembangan baru dimana terdapat banyak pohong Cemara udang rindang membentuk seperti goa, hal ini yang membuat pantai ini dinamai Goa Cemara. Pohon Cemara ini bertujuan untuk melindungi abrasi air laut dan menahan gumuk pasir supaya tidak mengalamai perpindahan akibat tiupan angin.",Bahari,Yogyakarta,4000,43,,"{'lat': -7.999422999999998, 'lng': 110.248963}",-7999423,110248963,,126,21,"Pantai Goa Cemara Pantai Goa Cemara (bahasa Jawa: ꦥꦱꦶꦱꦶꦂ​ ꦒꦸꦮ​ ꦕꦺꦩꦫ, translit. Pasisir Guwa Cemara​) adalah objek wisata pantai yang terletak di Dusun Patihan, Desa Gadingsari, Kecamatan Sanden, Kabupaten Bantul. Daerah Istimewa Yogyakarta. Pantai ini terletak tepatnya berdampingan dengan Pantai Samas dan Pantai Pandansari.\n\nPantai ini memiliki pasir berwarna hitam tapi lembut dengan ombak yang cukup besar kerakteristik pantai selatan. Pantai ini merupakan pantai pengembangan baru dimana terdapat banyak pohong Cemara udang rindang membentuk seperti goa, hal ini yang membuat pantai ini dinamai Goa Cemara. Pohon Cemara ini bertujuan untuk melindungi abrasi air laut dan menahan gumuk pasir supaya tidak mengalamai perpindahan akibat tiupan angin. Bahari Yogyakarta",pantai goa cemara pantai goa cemara bahasa jawa translit pasisir guwa cemara objek wisata pantai letak dusun patih desa gadingsari camat sanden kabupaten bantul daerah istimewa yogyakarta pantai letak tepat damping pantai samas pantai pandansari n npantai milik pasir warna hitam lembut ombak cukup besar kerakteristik pantai selatan pantai rupa pantai kembang baru dapat banyak pohong cemara udang rindang bentuk goa buat pantai nama goa cemara pohon cemara ini tuju lindung abrasi air laut tahan gumuk pasir tidak mengalamai pindah akibat tiup angin bahari yogyakarta
127,Blue Lagoon Jogja,"Blue Lagoon adalah salah satu wisata air Jogja yang sudah sangat terkenal dan banyak dikunjungi oleh wisatawan dari berbagai daerah penjuru. Banyak yang menganggap bahwa Blue Lagoon sebagai surga wisata Jogja tersembunyi. Meskipun keindahan yang ditawarkan oleh tempat ini sangat mahal, namun untuk bisa menikmatinya kamu tidak perlu merogoh kocek dalam2. Karena budget untuk masuk ke area wisata ini tidak semahal yang ada di Islandia.",Taman Hiburan,Yogyakarta,10000,43,,"{'lat': -7.7044358, 'lng': 110.45026}",-77044358,11045026,,127,30,"Blue Lagoon Jogja Blue Lagoon adalah salah satu wisata air Jogja yang sudah sangat terkenal dan banyak dikunjungi oleh wisatawan dari berbagai daerah penjuru. Banyak yang menganggap bahwa Blue Lagoon sebagai surga wisata Jogja tersembunyi. Meskipun keindahan yang ditawarkan oleh tempat ini sangat mahal, namun untuk bisa menikmatinya kamu tidak perlu merogoh kocek dalam2. Karena budget untuk masuk ke area wisata ini tidak semahal yang ada di Islandia. Taman Hiburan Yogyakarta",blue lagoon jogja blue lagoon salah satu wisata air jogja sudah sangat kenal banyak kunjung wisatawan bagai daerah penjuru banyak anggap blue lagoon surga wisata jogja sembunyi meski indah tawar tempat sangat mahal nikmat kamu perlu rogoh kocek karena budget untuk masuk area wisata tidak mahal ada islandia taman hibur yogyakarta
128,Gumuk Pasir Parangkusumo,"Gumuk Pasir Parangkusumo (bahasa Jawa: ꦒꦸꦩꦸꦏ꧀​ꦥꦱꦶꦂ​ꦥꦫꦁ​ꦏꦸꦱꦸꦩ, translit. Gumuk Pasir Parangkusuma) adalah objek wisata di Kabupaten Bantul, Yogyakarta, letaknya di sebelah barat Pantai Parangtritis, yaitu di Desa Parangtritis, Kecamatan Kretek, Kabupaten Bantul, Daerah Istimewa Yogyakarta. Gumuk Pasir ini memiliki sejumlah keistimewaan terkait dengan jumlahnya hanya terbatas di dunia.\nNama ""Gumuk"" berasal dari bahasa Jawa yang artinya gundukan-gundukan pasir yang terhampar luas. Gumuk Pasir Yogyakarta terbentuk dari material Gunung Merapi yang kemudian mengalami transportasi melalui Sungai Opak dan Sungai Progo yang kemudian terbawa ombak dan mengendap di pantai. Material yang mengendap kemudian mengering dan terbawa angin lalu terbang kedaratan sehingga mengalami proses deposisi menjadi Gumuk Pasir.",Taman Hiburan,Yogyakarta,0,45,90.0,"{'lat': -8.0173266, 'lng': 110.3180791}",-80173266,1103180791,,128,19,"Gumuk Pasir Parangkusumo Gumuk Pasir Parangkusumo (bahasa Jawa: ꦒꦸꦩꦸꦏ꧀​ꦥꦱꦶꦂ​ꦥꦫꦁ​ꦏꦸꦱꦸꦩ, translit. Gumuk Pasir Parangkusuma) adalah objek wisata di Kabupaten Bantul, Yogyakarta, letaknya di sebelah barat Pantai Parangtritis, yaitu di Desa Parangtritis, Kecamatan Kretek, Kabupaten Bantul, Daerah Istimewa Yogyakarta. Gumuk Pasir ini memiliki sejumlah keistimewaan terkait dengan jumlahnya hanya terbatas di dunia.\nNama ""Gumuk"" berasal dari bahasa Jawa yang artinya gundukan-gundukan pasir yang terhampar luas. Gumuk Pasir Yogyakarta terbentuk dari material Gunung Merapi yang kemudian mengalami transportasi melalui Sungai Opak dan Sungai Progo yang kemudian terbawa ombak dan mengendap di pantai. Material yang mengendap kemudian mengering dan terbawa angin lalu terbang kedaratan sehingga mengalami proses deposisi menjadi Gumuk Pasir. Taman Hiburan Yogyakarta",gumuk pasir parangkusumo gumuk pasir parangkusumo bahasa jawa translit gumuk pasir parangkusuma objek wisata kabupaten bantul yogyakarta letak belah barat pantai parangtritis desa parangtritis camat kretek kabupaten bantul daerah istimewa yogyakarta gumuk pasir milik jumlah istimewa kait jumlah batas dunia nnama gumuk asal bahasa jawa arti gundu gundu pasir hampar luas gumuk pasir yogyakarta bentuk material gunung rapi kemudian alami transportasi lalu sungai opak sungai progo kemudian bawa ombak endap di pantai material endap kemudian ering bawa angin lalu terbang darat alami proses deposisi jadi gumuk pasir taman hibur yogyakarta
129,Bukit Lintang Sewu,"Bukit Lintang Sewu ini berasal ketika pada saat malam hari di bukit ini terlihat ribuan bintang – bintang yang membentang luas di angkasa. Dalam bahasa Jawa Bukit Seribu Bintang adalah Bukit Lintang Sewu (lintang: bintang, sewu: seribu). Pemandangan alam yang tidak kalah mempesona membuat Bukit Langit Sewu ini menjadi tempat favorit bagi pecinta alam. Pada saat menuju bukit, pengunjung akan disuguhkan dengan pepohonan pinus, tetapi saat sampai pengunjung akan disuguhkan panorama hutan Kayu Putih yang menjadi keunikan tempat wisata ini. Diatas pohon Kayu Putih ini juga terdapat Burung Alap-alap yang melintas diatas pohonnya. Selain itu pengunjung juga akan dimanjakan dengan deretan pegunungan seperti Gunung merbabu, Gunung Sumbing, Menoreh, dan Gunung Merapi._x000D_",Taman Hiburan,Yogyakarta,2000,45,60.0,"{'lat': -7.915799699999999, 'lng': 110.4366436}",-79157997,1104366436,,129,17,"Bukit Lintang Sewu Bukit Lintang Sewu ini berasal ketika pada saat malam hari di bukit ini terlihat ribuan bintang – bintang yang membentang luas di angkasa. Dalam bahasa Jawa Bukit Seribu Bintang adalah Bukit Lintang Sewu (lintang: bintang, sewu: seribu). Pemandangan alam yang tidak kalah mempesona membuat Bukit Langit Sewu ini menjadi tempat favorit bagi pecinta alam. Pada saat menuju bukit, pengunjung akan disuguhkan dengan pepohonan pinus, tetapi saat sampai pengunjung akan disuguhkan panorama hutan Kayu Putih yang menjadi keunikan tempat wisata ini. Diatas pohon Kayu Putih ini juga terdapat Burung Alap-alap yang melintas diatas pohonnya. Selain itu pengunjung juga akan dimanjakan dengan deretan pegunungan seperti Gunung merbabu, Gunung Sumbing, Menoreh, dan Gunung Merapi._x000D_ Taman Hiburan Yogyakarta",bukit lintang sewu bukit lintang sewu asal malam hari bukit lihat ribu bintang bintang bentang luas angkasa bahasa jawa bukit ribu bintang bukit lintang sewu lintang bintang sewu ribu pandang alam tidak kalah pesona buat bukit langit sewu jadi tempat favorit cinta alam pada saat tuju bukit unjung suguh pohon pinus saat unjung suguh panorama hutan kayu putih jadi uni tempat wisata atas pohon kayu putih dapat burung alap alap lintas atas pohon itu unjung juga akan manja deret gunung gunung merbabu gunung sumbing toreh gunung rapi x d taman hibur yogyakarta
130,Studio Alam Gamplong,"Studio Gamplong atau Studio Alam Gamplong adalah sebuah tempat wisata yang terletak di Desa Gamplong, Kecamatan Moyudan, Kabupaten Sleman. Tempat tersebut awalnya adalah tempat pengambilan gambar film Sultan Agung: Tahta, Perjuangan, Cinta dan Bumi Manusia karya Hanung Bramantyo. Tempat tersebut didirikan di atas lahan seluas 2,5 hektar. Tempat tersebut diresmikan oleh Presiden Joko Widodo pada 15 Juli 2018.",Taman Hiburan,Yogyakarta,10000,44,120.0,"{'lat': -7.805793599999998, 'lng': 110.2367304}",-78057936,1102367304,,130,15,"Studio Alam Gamplong Studio Gamplong atau Studio Alam Gamplong adalah sebuah tempat wisata yang terletak di Desa Gamplong, Kecamatan Moyudan, Kabupaten Sleman. Tempat tersebut awalnya adalah tempat pengambilan gambar film Sultan Agung: Tahta, Perjuangan, Cinta dan Bumi Manusia karya Hanung Bramantyo. Tempat tersebut didirikan di atas lahan seluas 2,5 hektar. Tempat tersebut diresmikan oleh Presiden Joko Widodo pada 15 Juli 2018. Taman Hiburan Yogyakarta",studio alam gamplong studio gamplong studio alam gamplong buah tempat wisata letak desa gamplong camat moyudan kabupaten sleman tempat sebut awal tempat ambil gambar film sultan agung tahta juang cinta bumi manusia karya hanung bramantyo tempat sebut diri atas lahan luas hektar tempat sebut resmi presiden joko widodo juli taman hibur yogyakarta
